{
  "$id": "urn:aniukas-lossless-memory:format:1:grant",
  "$schema": "https://json-schema.org/draft/2020-12/schema",
  "additionalProperties": false,
  "properties": {
    "extensions": {
      "propertyNames": {
        "pattern": "^[a-z0-9]+[.][a-z0-9_.-]+$"
      },
      "type": "object"
    },
    "format_version": {
      "const": "1"
    },
    "generation": {
      "minimum": 1,
      "type": "integer"
    },
    "id": {
      "pattern": "^[A-Za-z][A-Za-z0-9_.:-]{1,127}$",
      "type": "string"
    },
    "instance_id": {
      "pattern": "^[A-Za-z][A-Za-z0-9_.:-]{1,127}$",
      "type": "string"
    },
    "issued_at": {
      "format": "date-time",
      "pattern": "^\\d{4}-\\d{2}-\\d{2}T\\d{2}:\\d{2}:\\d{2}Z$",
      "type": "string"
    },
    "issued_by": {
      "pattern": "^[A-Za-z][A-Za-z0-9_.:-]{1,127}$",
      "type": "string"
    },
    "kind": {
      "const": "grant"
    },
    "operations": {
      "items": {
        "enum": [
          "commit",
          "review",
          "propose",
          "observe"
        ]
      },
      "minItems": 1,
      "type": "array",
      "uniqueItems": true
    },
    "principal_id": {
      "pattern": "^[A-Za-z][A-Za-z0-9_.:-]{1,127}$",
      "type": "string"
    },
    "revoked_at": {
      "anyOf": [
        {
          "format": "date-time",
          "pattern": "^\\d{4}-\\d{2}-\\d{2}T\\d{2}:\\d{2}:\\d{2}Z$",
          "type": "string"
        },
        {
          "type": "null"
        }
      ]
    },
    "role": {
      "enum": [
        "USER",
        "GOVERNOR",
        "PROJECT_OWNER",
        "TASK_OWNER",
        "WORKER",
        "AUDITOR"
      ]
    },
    "scope_id": {
      "pattern": "^[A-Za-z][A-Za-z0-9_.:-]{1,127}$",
      "type": "string"
    }
  },
  "required": [
    "format_version",
    "instance_id",
    "kind",
    "id",
    "principal_id",
    "scope_id",
    "role",
    "generation",
    "operations",
    "issued_by",
    "issued_at",
    "revoked_at"
  ],
  "title": "Aniukas Lossless Memory profile 1: grant",
  "type": "object"
}
