{
  "format_version": "1",
  "generation": 1,
  "id": "GRANT-GLOBAL",
  "instance_id": "alm.synthetic.example",
  "issued_at": "2026-09-23T00:00:00Z",
  "issued_by": "principal:human-admin",
  "kind": "grant",
  "operations": [
    "commit",
    "review",
    "propose",
    "observe"
  ],
  "principal_id": "principal:governor",
  "revoked_at": null,
  "role": "GOVERNOR",
  "scope_id": "GLOBAL"
}
